{
  "version": 1,
  "date": "2099-01-02",
  "capturedAt": "2099-01-02T20:00:00Z",
  "timezone": "America/Los_Angeles",
  "editions": [
    {
      "editionId": "2099-01-02-morning",
      "slot": "morning",
      "due": true,
      "dispatch": {"state": "observed", "occurredAt": "2099-01-02T12:00:00Z", "sourceRef": "fixture:dispatch:2"},
      "site": {"state": "observed", "occurredAt": "2099-01-02T12:11:00Z", "httpStatus": 200, "exactTitleVerified": true, "sourceRef": "fixture:site:2"},
      "workflow": {"state": "observed", "conclusion": "success", "sourceRef": "fixture:workflow:2"},
      "x": {"state": "observed", "occurredAt": "2099-01-02T12:16:00Z", "status": "sent", "sourceRef": "fixture:x:2"},
      "telegram": {"state": "observed", "occurredAt": "2099-01-02T12:11:01Z", "status": "sent", "sourceRef": "fixture:telegram:2"},
      "watchdog": {"state": "observed", "occurredAt": "2099-01-02T12:20:00Z", "result": "exact_edition_present", "sourceRef": "fixture:watchdog:2"}
    }
  ],
  "audience": []
}
